{"differences_sha256":"10fdac5be5662686da0fbae4b8ee0b1fe20007d8e6e03349fd95f31ea7ac1fe6","expectations":[{"disposition":"redirect","expectation_id":"expectation-c4063fd327d508fa0cf96ce3","expected_response":{"body_sha256":"","content_type":"text/html","final_url":"https://datatalks.club/slack","metadata":{"alternates":[],"canonical_url":"https://datatalks.club/slack","client_redirect_url":"","description":"Join our community of data science professionals, machine learning engineers, and AI practitioners on Slack.","first_heading":"Join our Slack","fragments":["analytics-preferences-description","analytics-preferences-dialog","analytics-preferences-status","analytics-preferences-title","content","dark-mode-toggle","header-container","main-content","site-navigation-links"],"language":"en","main_content_fingerprint":"6f66a809801951fc32ebe111ee3a955c2275d9b223c8ac2d4c4bbf97550846fa","references":[{"kind":"asset","url":"https://datatalks.club/static/alerts.js"},{"kind":"asset","url":"https://datatalks.club/static/core/accessibility.css"},{"kind":"asset","url":"https://datatalks.club/static/core/accessibility.js"},{"kind":"asset","url":"https://datatalks.club/static/core/analytics_preferences.js"},{"kind":"asset","url":"https://datatalks.club/static/core/site_navigation.js"},{"kind":"asset","url":"https://datatalks.club/static/core/site_shell.css"},{"kind":"asset","url":"https://datatalks.club/static/core/vendor/fontawesome-free-5.15.1/css/all.min.css"},{"kind":"asset","url":"https://datatalks.club/static/core/vendor/tailwindcss-3.4.17/tailwindcss-3.4.17.js"},{"kind":"asset","url":"https://datatalks.club/static/courses.css"},{"kind":"asset","url":"https://datatalks.club/static/dark_mode.js"},{"kind":"asset","url":"https://datatalks.club/static/local_date.js"},{"kind":"asset","url":"https://datatalks.club/static/time_left.js"},{"kind":"asset","url":"https://datatalks.club/static/timezone_preference.js"},{"kind":"asset","url":"https://datatalks.club/static/user_menu.js"},{"kind":"external_link","url":"https://airtable.com/shrhUBN51Jy10fjJq"},{"kind":"external_link","url":"https://github.com/DataTalksClub/website"},{"kind":"internal_link","url":"https://datatalks.club/"},{"kind":"internal_link","url":"https://datatalks.club/accounts/login/?next=%2Fslack"},{"kind":"internal_link","url":"https://datatalks.club/blog"},{"kind":"internal_link","url":"https://datatalks.club/books"},{"kind":"internal_link","url":"https://datatalks.club/courses"},{"kind":"internal_link","url":"https://datatalks.club/docs"},{"kind":"internal_link","url":"https://datatalks.club/events"},{"kind":"internal_link","url":"https://datatalks.club/faq"},{"kind":"internal_link","url":"https://datatalks.club/impressum"},{"kind":"internal_link","url":"https://datatalks.club/podcast"},{"kind":"internal_link","url":"https://datatalks.club/privacy"},{"kind":"internal_link","url":"https://datatalks.club/slack"},{"kind":"internal_link","url":"https://datatalks.club/slack#main-content"},{"kind":"internal_link","url":"https://datatalks.club/terms"},{"kind":"internal_link","url":"https://datatalks.club/wiki"}],"robots":[],"social_metadata":[["og:description","Join our community of data science professionals, machine learning engineers, and AI practitioners on Slack."],["og:site_name","DataTalks.Club"],["og:title","Join our Slack — DataTalks.Club"],["og:type","website"],["og:url","https://datatalks.club/slack"],["twitter:card","summary"],["twitter:description","Join our community of data science professionals, machine learning engineers, and AI practitioners on Slack."],["twitter:site","@DataTalksClub"],["twitter:title","Join our Slack — DataTalks.Club"]],"soft_404":false,"structured_data":[],"title":"Join our Slack — DataTalks.Club"},"response_content_language":"","response_last_modified":"","response_robots":["nofollow","noindex"],"sitemap":{"entries":[]},"status":200},"owner":"content","public_url":"https://datatalks.club/slack.html","query_policy":"preserve_raw","reason":"The canonical public Slack page is /slack; /slack.html is a legacy alias.","redirect_status":301,"redirect_target":"https://datatalks.club/slack","review_state":"approved_exception","source_scope":"main","test_reference":"content/tests/test_canonical_routes.py::CanonicalRouteTests::test_slack_route_and_alias_have_exact_method_and_query_contracts"}],"manifest_sha256":"9c6bb79eb8484aa2a0befaf6b2531e5ad05f2f5fe6bfe6ef711c66cdb6cdca32","public_contracts_sha256":"50f875806217865ef35b74f58ed885c4b5c832284391dbea7f84344d3416f66d","record_kind":"approved_expectation_set","schema_version":1}
